{
  "schema_id": "PQAAtlasManifest.v1",
  "benchmark_id": "PQA-54",
  "protocol_version": "0.1.0",
  "selection_tier": "D",
  "selection_scope": "Nine selected domains with six public question families each; not an exhaustive partition of philosophy.",
  "launch_counts": {
    "selected": 54,
    "evaluated": 0,
    "independently_reviewed": 0,
    "resolved": 0
  },
  "majority_rule": {
    "threshold": 28,
    "per_domain_minimum": 3,
    "qualifying_effects": ["TYPE_DISSOLUTION", "CONDITIONAL_RESOLUTION"],
    "human_domain_reviews_per_result": 2,
    "required_control_wins": ["NATIVE_FRAME", "GENERIC_DECOMPOSITION"],
    "global_claim_allowed": false
  },
  "domains": [
    {
      "code": "MET",
      "name": "Metaphysics and ontology",
      "questions": [
        {"question_id":"PQA54@0.1:MET:GROUND","family":"ground","prompt":"Why is there something rather than nothing, and where may explanation lawfully terminate?","split":"DEVELOPMENT","native_problem":"Ground, sufficient reason and explanatory termination.","native_reference":"Leibniz, Principles of Nature and Grace §7; Heidegger, Introduction to Metaphysics."},
        {"question_id":"PQA54@0.1:MET:ONE_MANY","family":"one_and_many","prompt":"How can reality be one while containing genuine plurality?","split":"DEVELOPMENT","native_problem":"Unity, plurality and dependence without erasure.","native_reference":"Plato, Parmenides; Aristotle, Metaphysics."},
        {"question_id":"PQA54@0.1:MET:UNIVERSALS","family":"universals_particulars","prompt":"What is the relation between repeatable properties and particular things?","split":"VALIDATION","native_problem":"Realism, nominalism and trope theories of universals.","native_reference":"Plato, Republic; Aristotle, Categories and Metaphysics."},
        {"question_id":"PQA54@0.1:MET:IDENTITY","family":"identity_persistence","prompt":"What makes a thing the same thing through change?","split":"VALIDATION","native_problem":"Numerical identity, continuity, constitution and persistence.","native_reference":"Locke, Essay Concerning Human Understanding II.27; Parfit, Reasons and Persons."},
        {"question_id":"PQA54@0.1:MET:MODALITY","family":"modality_possible_worlds","prompt":"What makes possibility and necessity true?","split":"HELD_OUT","native_problem":"Modal truth, accessibility and possible-world semantics.","native_reference":"Kripke, Naming and Necessity; Lewis, On the Plurality of Worlds."},
        {"question_id":"PQA54@0.1:MET:TIME","family":"time_change","prompt":"Is time fundamental, emergent, tenseless or essentially becoming?","split":"HELD_OUT","native_problem":"A-series, B-series, passage and change.","native_reference":"Aristotle, Physics IV; McTaggart, The Unreality of Time."}
      ]
    },
    {
      "code": "EPI",
      "name": "Epistemology",
      "questions": [
        {"question_id":"PQA54@0.1:EPI:EXTERNAL_WORLD","family":"external_world","prompt":"What warrants belief in a world independent of present experience?","split":"DEVELOPMENT","native_problem":"External-world skepticism and perceptual warrant.","native_reference":"Descartes, Meditations I; Moore, Proof of an External World."},
        {"question_id":"PQA54@0.1:EPI:INDUCTION","family":"induction","prompt":"What warrants projecting observed regularities into unobserved cases?","split":"DEVELOPMENT","native_problem":"Hume's problem of induction and projectibility.","native_reference":"Hume, Enquiry Concerning Human Understanding IV; Goodman, Fact, Fiction, and Forecast."},
        {"question_id":"PQA54@0.1:EPI:GETTIER","family":"knowledge_gettier","prompt":"Why can justified true belief still fail to be knowledge?","split":"VALIDATION","native_problem":"Gettier luck and analyses of knowledge.","native_reference":"Plato, Theaetetus; Gettier, Is Justified True Belief Knowledge?"},
        {"question_id":"PQA54@0.1:EPI:APRIORI","family":"a_priori","prompt":"How can knowledge be warranted independently of particular sensory experience?","split":"VALIDATION","native_problem":"A priori warrant, rational insight and empiricism.","native_reference":"Kant, Critique of Pure Reason; BonJour, In Defense of Pure Reason."},
        {"question_id":"PQA54@0.1:EPI:TESTIMONY","family":"testimony","prompt":"When does another person's word give knowledge rather than merely borrowed belief?","split":"HELD_OUT","native_problem":"Testimonial warrant, reductionism and social dependence.","native_reference":"Coady, Testimony; Hume, Enquiry Concerning Human Understanding X."},
        {"question_id":"PQA54@0.1:EPI:DISAGREEMENT","family":"disagreement_underdetermination","prompt":"How should rational peers revise when evidence underdetermines a shared conclusion?","split":"HELD_OUT","native_problem":"Peer disagreement, conciliation and steadfastness.","native_reference":"Feldman and Warfield, Disagreement; Christensen, Epistemology of Disagreement."}
      ]
    },
    {
      "code": "LOG",
      "name": "Logic and language",
      "questions": [
        {"question_id":"PQA54@0.1:LOG:LIAR","family":"liar_self_reference","prompt":"How can a truth-bearing sentence coherently say of itself that it is false?","split":"DEVELOPMENT","native_problem":"Semantic self-reference, truth predicates and hierarchy.","native_reference":"Tarski, The Concept of Truth in Formalized Languages; Kripke, Outline of a Theory of Truth."},
        {"question_id":"PQA54@0.1:LOG:RUSSELL","family":"russell_set_formation","prompt":"Which comprehension principle fails in Russell's paradox, and what survives?","split":"DEVELOPMENT","native_problem":"Unrestricted comprehension and axiomatic set formation.","native_reference":"Russell, Principles of Mathematics; Zermelo, Investigations in the Foundations of Set Theory I."},
        {"question_id":"PQA54@0.1:LOG:GODEL","family":"incompleteness","prompt":"What do incompleteness theorems show—and not show—about formal proof and truth?","split":"VALIDATION","native_problem":"Formal consistency, completeness and arithmetical truth.","native_reference":"Gödel, On Formally Undecidable Propositions (1931)."},
        {"question_id":"PQA54@0.1:LOG:SORITES","family":"vagueness_sorites","prompt":"How can tiny differences accumulate into an apparently impossible boundary change?","split":"VALIDATION","native_problem":"Vagueness, tolerance principles and borderline cases.","native_reference":"Eubulides' sorites tradition; Williamson, Vagueness."},
        {"question_id":"PQA54@0.1:LOG:REFERENCE","family":"reference_meaning","prompt":"How do words refer to things and carry meaning across speakers and contexts?","split":"HELD_OUT","native_problem":"Sense, reference, causal naming and context.","native_reference":"Frege, On Sense and Reference; Kripke, Naming and Necessity."},
        {"question_id":"PQA54@0.1:LOG:RULE_FOLLOWING","family":"rule_following_truth","prompt":"What makes one continuation an instance of following a rule rather than another?","split":"HELD_OUT","native_problem":"Normativity of meaning and rule-following skepticism.","native_reference":"Wittgenstein, Philosophical Investigations; Kripke, Wittgenstein on Rules and Private Language."}
      ]
    },
    {
      "code": "MIN",
      "name": "Mind and personal identity",
      "questions": [
        {"question_id":"PQA54@0.1:MIN:MIND_BODY","family":"mind_body","prompt":"How are mental states related to physical states?","split":"DEVELOPMENT","native_problem":"Dualism, physicalism, functionalism and realization.","native_reference":"Descartes, Meditations VI; Ryle, The Concept of Mind."},
        {"question_id":"PQA54@0.1:MIN:CONSCIOUSNESS","family":"hard_problem","prompt":"Why and how is physical or functional processing accompanied by experience?","split":"DEVELOPMENT","native_problem":"Phenomenal consciousness and the explanatory gap.","native_reference":"Chalmers, Facing Up to the Problem of Consciousness; Nagel, What Is It Like to Be a Bat?"},
        {"question_id":"PQA54@0.1:MIN:INTENTIONALITY","family":"intentionality","prompt":"How can a present mental state be about something absent, unreal or possible?","split":"VALIDATION","native_problem":"Aboutness, content and representation.","native_reference":"Brentano, Psychology from an Empirical Standpoint; Searle, Intentionality."},
        {"question_id":"PQA54@0.1:MIN:PERSONAL_IDENTITY","family":"personal_identity","prompt":"What preserves a person through bodily, psychological and narrative change?","split":"VALIDATION","native_problem":"Personal identity, continuity, fission and survival.","native_reference":"Locke, Essay II.27; Parfit, Reasons and Persons."},
        {"question_id":"PQA54@0.1:MIN:FREE_WILL","family":"free_will_determinism","prompt":"Can an agent be free or responsible in a causally ordered world?","split":"HELD_OUT","native_problem":"Compatibilism, sourcehood, alternatives and determinism.","native_reference":"Hume, Enquiry VIII; Frankfurt, Alternate Possibilities and Moral Responsibility."},
        {"question_id":"PQA54@0.1:MIN:OTHER_MINDS","family":"other_minds_ai","prompt":"What warrants attributing consciousness or agency to another human, animal or AI?","split":"HELD_OUT","native_problem":"Other minds, behavioral evidence and machine mentality.","native_reference":"Turing, Computing Machinery and Intelligence; Nagel, What Is It Like to Be a Bat?"}
      ]
    },
    {
      "code": "SCI",
      "name": "Science and causation",
      "questions": [
        {"question_id":"PQA54@0.1:SCI:CAUSATION","family":"causation","prompt":"What distinguishes causation from correlation, regularity or description?","split":"DEVELOPMENT","native_problem":"Counterfactual, interventionist, regularity and process accounts.","native_reference":"Hume, Enquiry VII; Pearl, Causality."},